{
  "bundle": {
    "feature_state": {
      "access_matrix": {
        "enabled": true,
        "settings": {
          "levels": [
            "none",
            "read",
            "create",
            "work"
          ]
        }
      },
      "checklists": {
        "enabled": true,
        "settings": {}
      },
      "cross_department_handoff": {
        "enabled": true,
        "settings": {
          "modes": [
            "consultation",
            "transfer",
            "sanitized_child",
            "split_work"
          ]
        }
      },
      "dummy_users_uat": {
        "enabled": true,
        "settings": {}
      },
      "group_classification": {
        "enabled": true,
        "settings": {}
      },
      "macros": {
        "enabled": true,
        "settings": {}
      },
      "organization_classification": {
        "enabled": true,
        "settings": {}
      },
      "overviews": {
        "enabled": true,
        "settings": {}
      },
      "report_profiles": {
        "enabled": true,
        "settings": {}
      },
      "scheduled_reviews": {
        "enabled": true,
        "settings": {}
      },
      "sensitive_area_handling": {
        "enabled": true,
        "settings": {}
      },
      "ticket_fields": {
        "enabled": true,
        "settings": {
          "customer_entry_points": []
        }
      },
      "triggers": {
        "enabled": true,
        "settings": {}
      },
      "user_classification": {
        "enabled": true,
        "settings": {}
      }
    },
    "manifest": {
      "checklist_templates": [
        {
          "active": false,
          "items": [
            "Confirm service and accountable group",
            "Check whether sensitive data is minimized",
            "Set owner and next step"
          ],
          "key": "standard_intake",
          "name": "University Template · Checklist · Standard intake"
        }
      ],
      "groups": [
        {
          "active": true,
          "key": "university",
          "kind": "container",
          "name": "University Template · University"
        },
        {
          "active": true,
          "key": "administration",
          "kind": "container",
          "name": "University Template · Administration",
          "parent": "university"
        },
        {
          "active": true,
          "key": "human_resources",
          "kind": "leaf",
          "name": "University Template · Human Resources",
          "parent": "administration",
          "restricted": true,
          "service_code": "ADM.HUMAN_RESOURCES"
        },
        {
          "active": true,
          "key": "finance",
          "kind": "leaf",
          "name": "University Template · Finance",
          "parent": "administration",
          "restricted": true,
          "service_code": "ADM.FINANCE"
        },
        {
          "active": true,
          "key": "academic_services",
          "kind": "container",
          "name": "University Template · Academic Services",
          "parent": "university"
        },
        {
          "active": true,
          "key": "student_services",
          "kind": "leaf",
          "name": "University Template · Student Services",
          "parent": "academic_services",
          "service_code": "ACA.STUDENT_SERVICES"
        },
        {
          "active": true,
          "key": "examinations",
          "kind": "leaf",
          "name": "University Template · Examinations",
          "parent": "academic_services",
          "restricted": true,
          "service_code": "ACA.EXAMINATIONS"
        },
        {
          "active": true,
          "key": "library",
          "kind": "leaf",
          "name": "University Template · Library",
          "parent": "academic_services",
          "service_code": "ACA.LIBRARY"
        },
        {
          "active": true,
          "key": "digital_services",
          "kind": "container",
          "name": "University Template · Digital Services",
          "parent": "university"
        },
        {
          "active": true,
          "key": "it_support",
          "kind": "leaf",
          "name": "University Template · IT Support",
          "parent": "digital_services",
          "service_code": "DIGITAL.IT_SUPPORT"
        },
        {
          "active": true,
          "key": "information_security",
          "kind": "leaf",
          "name": "University Template · Information Security",
          "parent": "digital_services",
          "restricted": true,
          "service_code": "DIGITAL.INFORMATION_SECURITY"
        }
      ],
      "jobs": [
        {
          "actions": [
            "internal_note:stale_handoff_template",
            "add_tag:university/stale_reviewed"
          ],
          "active": true,
          "conditions": {
            "all": [
              "group in H",
              "organization in O",
              "state open_like",
              "tag present university/handoff_pending",
              "unchanged_at_least_days:14"
            ]
          },
          "external_effects": false,
          "forbidden_actions": [
            "delete",
            "close",
            "mail",
            "webhook",
            "ai",
            "public_article",
            "group_move",
            "owner_change"
          ],
          "idempotency": "The internal note and tag update reset updated_at; an unresolved handoff can be reviewed again only after another 14 days",
          "key": "review_stale_handoff",
          "name": "University Template · Job · Review stale handoff",
          "schedule": "10 7 * * * Etc/UTC",
          "schedule_note": "Inert template default; choose the tenant time zone and review interval before any connected delivery"
        }
      ],
      "macros": [
        {
          "actions": [
            "set_state_closed"
          ],
          "key": "resolve",
          "name": "University Template · Macro · Resolve",
          "scope": "H"
        },
        {
          "actions": [
            "add_tag:university/handoff_pending",
            "clear_owner",
            "internal_note:Prepare a minimized internal handoff record"
          ],
          "key": "prepare_handoff",
          "name": "University Template · Macro · Prepare handoff",
          "scope": "H"
        }
      ],
      "managed_prefix": "University Template ·",
      "manifest_key": "university-service-desk-v1",
      "object_manager": {
        "activation": "mandatory_provider_maintenance_path",
        "core_workflows": [
          {
            "actions": "show managed fields for the selected service",
            "context": "agent_create",
            "key": "agent_create_shared",
            "match": "role in R and group in H"
          }
        ],
        "group_fields": [
          {
            "api_only": true,
            "name": "university_group_class",
            "options": [
              "container",
              "service",
              "restricted"
            ],
            "type": "select"
          }
        ],
        "implementation_sequence": [
          "create_6_attributes_inactive",
          "execute_object_manager_migrations",
          "provider_restart",
          "health_and_ticket_ingestion_checks",
          "activate_attributes_hidden_optional",
          "negative_production_field_checks",
          "create_core_workflow_inactive",
          "activate_core_workflow_after_negative_checks"
        ],
        "organization_fields": [
          {
            "api_only": true,
            "name": "university_organization_class",
            "options": [
              "student",
              "academic_staff",
              "professional_services",
              "external"
            ],
            "type": "select"
          }
        ],
        "production_impact_claim": "zero_observable_impact_not_claimable",
        "restart_required": true,
        "tenant_default": {
          "default": null,
          "hidden": true,
          "no_date_or_datetime": true,
          "optional": true
        },
        "ticket_fields": [
          {
            "name": "university_service_code",
            "options": [
              "ADM.HUMAN_RESOURCES",
              "ADM.FINANCE",
              "ACA.STUDENT_SERVICES",
              "ACA.EXAMINATIONS",
              "ACA.LIBRARY",
              "DIGITAL.IT_SUPPORT",
              "DIGITAL.INFORMATION_SECURITY"
            ],
            "required_by_workflow": true,
            "type": "tree_select"
          },
          {
            "name": "university_handoff_type",
            "options": [
              "consultation",
              "transfer",
              "sanitized_child",
              "split_work"
            ],
            "required_by_workflow": true,
            "type": "select"
          },
          {
            "name": "university_sensitive_area",
            "options": [
              "no",
              "yes"
            ],
            "required_by_workflow": true,
            "type": "select"
          }
        ],
        "user_fields": [
          {
            "api_only": true,
            "name": "university_user_population",
            "options": [
              "student",
              "academic_staff",
              "professional_services",
              "external"
            ],
            "type": "select"
          }
        ]
      },
      "organizations": [
        {
          "active": true,
          "class": "student",
          "domain_assignment": false,
          "key": "students",
          "name": "University Template · Organization · Students",
          "shared": false
        },
        {
          "active": true,
          "class": "academic_staff",
          "domain_assignment": false,
          "key": "academic_staff",
          "name": "University Template · Organization · Academic staff",
          "shared": false
        },
        {
          "active": true,